<package xmlns:xsi="http://www.w3.org/2001/XMLSchema-instance" xmlVersion="1.8" xsi:noNamespaceSchemaLocation="../../package-thinned-out-schema.xsd"><name><de>Solution Template - Objectives &amp; Key Results</de><en>Solution Template - Objectives &amp; Key Results</en></name><slots><slot><name><de>Objectives Key Results</de><en>Objectives Key Results</en></name><internalName>cf.cplace.okr.okr</internalName><workspaceName>OKR</workspaceName><type><name>cf.cplace.solution.okr.cycle</name><localizedNameSingular><en>Cycle</en><de>Zyklus</de></localizedNameSingular><localizedNamePlural><en>Cycles</en><de>Zyklen</de></localizedNamePlural><iconName>fa-redo</iconName><attributes><name>cf.cplace.solution.okr.year</name><localizedName><en>Year</en><de>Jahr</de></localizedName><localizedShortName /><shortHelp /><stringConstraint /><multiplicity>exactlyOne</multiplicity></attributes><attributes><name>cf.cplace.solution.okr.quarter</name><localizedName><en>Quarter</en><de>Quartal</de></localizedName><localizedShortName /><shortHelp /><stringConstraint /><multiplicity>exactlyOne</multiplicity></attributes><attributes><name>cf.cplace.solution.okr.status</name><localizedName><en>Status</en><de>Status</de></localizedName><localizedShortName /><shortHelp /><textEnumerationConstraint><element><value>#15 Next</value><icon>harvey-ball-red-100</icon><localizedName><de>Nächster</de><en>Next</en></localizedName></element><element><value>#25 Current</value><icon>harvey-ball-red-100</icon><localizedName><de>Aktuell</de><en>Current</en></localizedName></element><element><value>#35 Closed</value><icon>harvey-ball-red-100</icon><localizedName><de>Geschlossen</de><en>Closed</en></localizedName></element><element><value>#45 Draft</value><icon>harvey-ball-red-100</icon><localizedName><de>Entwurf</de><en>Draft</en></localizedName></element></textEnumerationConstraint><multiplicity>exactlyOne</multiplicity></attributes><attributes><name>cf.cplace.solution.okr.start</name><localizedName><en>Start</en><de>Start</de></localizedName><localizedShortName /><shortHelp /><dateConstraint><specificity>DAY</specificity><dateFormat>DAY_YEAR_LONG</dateFormat></dateConstraint><multiplicity>maximalOne</multiplicity></attributes><attributes><name>cf.cplace.solution.okr.end</name><localizedName><en>End</en><de>Ende</de></localizedName><localizedShortName /><shortHelp /><dateConstraint><specificity>DAY</specificity><dateFormat>DAY_YEAR_LONG</dateFormat></dateConstraint><multiplicity>maximalOne</multiplicity></attributes></type><type><name>cf.cplace.solution.okr.objective</name><localizedNameSingular><en>Objective</en><de>Objective</de></localizedNameSingular><localizedNamePlural><en>Objectives</en><de>Objectives</de></localizedNamePlural><iconName>fa-bullseye</iconName><attributes><name>cf.cplace.solution.okr.number</name><localizedName><en>Number</en><de>Nummer</de></localizedName><localizedShortName><en>No.</en><de>Nr.</de></localizedShortName><shortHelp /><numberConstraint><precision>-1</precision><localizedTextAfterSupplier /></numberConstraint><multiplicity>exactlyOne</multiplicity></attributes><attributes><name>cf.cplace.solution.okr.title</name><localizedName><en>Title</en><de>Titel</de></localizedName><localizedShortName /><shortHelp /><stringConstraint /><multiplicity>maximalOne</multiplicity></attributes><attributes><name>cf.cplace.solution.okr.accomplished</name><localizedName><en>Accomplished</en><de>Erreicht</de></localizedName><localizedShortName /><shortHelp /><textEnumerationConstraint><defaultValues>s#25 - no</defaultValues><element><value>#15 - yes</value><icon>x-112-cplace-square-green-check</icon><localizedName><de>Ja</de><en>Yes</en></localizedName></element><element><value>#25 - no</value><icon>x-103-cplace-square-red-close</icon><localizedName><de>Nein</de><en>No</en></localizedName></element></textEnumerationConstraint><multiplicity>maximalOne</multiplicity></attributes><attributes><name>cf.cplace.solution.okr.description</name><localizedName><en>Description</en><de>Beschreibung</de></localizedName><localizedShortName /><shortHelp /><richStringConstraint /><multiplicity>maximalOne</multiplicity></attributes></type><type><name>cf.cplace.solution.okr.keyResult</name><localizedNameSingular><en>Key Result</en><de>Schlüsselergebnis</de></localizedNameSingular><localizedNamePlural><en>Key Results</en><de>Schlüsselergebnisse</de></localizedNamePlural><iconName>fa-key</iconName><attributes><name>cf.cplace.solution.okr.number</name><localizedName><en>Number</en><de>Nummer</de></localizedName><localizedShortName><en>No.</en><de>Nr.</de></localizedShortName><shortHelp /><numberConstraint><precision>-1</precision><localizedTextAfterSupplier /></numberConstraint><multiplicity>exactlyOne</multiplicity></attributes><attributes><name>cf.cplace.solution.okr.title</name><localizedName><en>Title</en><de>Titel</de></localizedName><localizedShortName /><shortHelp /><stringConstraint /><multiplicity>maximalOne</multiplicity></attributes><attributes><name>cf.cplace.solution.okr.gradingForecast</name><localizedName><en>Grading Forecast</en><de>Fortschritt Vorhersage</de></localizedName><localizedShortName /><shortHelp /><textEnumerationConstraint><element><value>0.1</value><icon>circle-001-red</icon><localizedName><de>0.1</de><en>0.1</en></localizedName></element><element><value>0.2</value><icon>circle-001-red</icon><localizedName><de>0.2</de><en>0.2</en></localizedName></element><element><value>0.3</value><icon>circle-001-red</icon><localizedName><de>0.3</de><en>0.3</en></localizedName></element><element><value>0.4</value><icon>circle-002-yellow</icon><localizedName><de>0.4</de><en>0.4</en></localizedName></element><element><value>0.5</value><icon>circle-002-yellow</icon><localizedName><de>0.5</de><en>0.5</en></localizedName></element><element><value>0.6</value><icon>circle-002-yellow</icon><localizedName><de>0.6</de><en>0.6</en></localizedName></element><element><value>0.7</value><icon>circle-003-green</icon><localizedName><de>0.7</de><en>0.7</en></localizedName></element><element><value>0.8</value><icon>circle-003-green</icon><localizedName><de>0.8</de><en>0.8</en></localizedName></element><element><value>0.9</value><icon>circle-003-green</icon><localizedName><de>0.9</de><en>0.9</en></localizedName></element><element><value>1.0</value><icon>circle-003-green</icon><localizedName><de>1.0</de><en>1.0</en></localizedName></element></textEnumerationConstraint><multiplicity>maximalOne</multiplicity></attributes><attributes><name>cf.cplace.solution.okr.objective</name><localizedName><en>Objective</en><de>Objective</de></localizedName><localizedShortName /><shortHelp /><referenceConstraint><typeNames>cf.cplace.solution.okr.objective</typeNames><entityClass>cf.cplace.platform.assets.file.Page</entityClass><localizedInverseRoleName /><sameWorkspace>true</sameWorkspace><isHierarchy>true</isHierarchy></referenceConstraint><multiplicity>exactlyOne</multiplicity></attributes><attributes><name>cf.cplace.solution.okr.lastUpdate</name><localizedName><en>Last Update</en><de>Letztes Update</de></localizedName><localizedShortName /><shortHelp /><dateConstraint><specificity>DAY</specificity><dateFormat>DAY_YEAR_LONG</dateFormat></dateConstraint><multiplicity>maximalOne</multiplicity></attributes></type></slot></slots><internalName>cf.cplace.template.okr</internalName><version>10</version></package>