<solutionManagement xmlns:xsi="http://www.w3.org/2001/XMLSchema-instance" xmlVersion="1.8" xsi:noNamespaceSchemaLocation="../package-thinned-out-schema.xsd">
  <package internalName="cf.cplace.riskManagement" version="1">
    <name>
      <de>Risikomanagement-Anwendung</de>
      <en>Risk Management Application</en>
    </name>
    <shortname />
    <slots>
      <slot internalName="cf.cplace.riskManagement.risks">
        <name>
          <de>Risiken</de>
          <en>Risks</en>
        </name>
        <workspace>
          <name>RiskManagement</name>
          <types>
            <typeDef>
              <name>cf.cplace.riskManagement.risk</name>
              <localizedNameSingular>
                <en>Risk</en>
                <de>Risiko</de>
              </localizedNameSingular>
              <localizedNamePlural>
                <en>Risks</en>
                <de>Risiken</de>
              </localizedNamePlural>
              <iconName>fa-exclamation-triangle</iconName>
              <attributes>
                <name>cf.cplace.riskManagement.risk.name</name>
                <localizedName>
                  <en>Name</en>
                  <de>Name</de>
                </localizedName>
                <localizedShortName />
                <shortHelp />
                <constraintFactory type="stringConstraint">
                  <multiplicity>
                    <key>exactlyOne</key>
                  </multiplicity>
                  <attributeDefClass>cf.cplace.platform.assets.custom.def.SingleStringAttributeDef</attributeDefClass>
                </constraintFactory>
              </attributes>
              <attributes>
                <name>cf.cplace.riskManagement.risk.description</name>
                <localizedName>
                  <en>Description</en>
                  <de>Beschreibung</de>
                </localizedName>
                <localizedShortName />
                <shortHelp />
                <constraintFactory type="richStringConstraint">
                  <multiplicity>
                    <key>exactlyOne</key>
                  </multiplicity>
                  <attributeDefClass>cf.cplace.platform.assets.custom.def.SingleRichStringAttributeDef</attributeDefClass>
                </constraintFactory>
              </attributes>
              <attributes>
                <name>cf.cplace.riskManagement.risk.probability</name>
                <localizedName>
                  <en>Probability</en>
                  <de>Wahrscheinlichkeit</de>
                </localizedName>
                <localizedShortName />
                <shortHelp />
                <constraintFactory type="numberConstraint">
                  <precision>2</precision>
                  <localizedTextAfterSupplier />
                  <multiplicity>
                    <key>exactlyOne</key>
                  </multiplicity>
                  <attributeDefClass>cf.cplace.platform.assets.custom.def.SingleNumberAttributeDef</attributeDefClass>
                </constraintFactory>
              </attributes>
              <attributes>
                <name>cf.cplace.riskManagement.risk.impact</name>
                <localizedName>
                  <en>Impact</en>
                  <de>Auswirkung</de>
                </localizedName>
                <localizedShortName />
                <shortHelp />
                <constraintFactory type="numberConstraint">
                  <precision>2</precision>
                  <localizedTextAfterSupplier />
                  <multiplicity>
                    <key>exactlyOne</key>
                  </multiplicity>
                  <attributeDefClass>cf.cplace.platform.assets.custom.def.SingleNumberAttributeDef</attributeDefClass>
                </constraintFactory>
              </attributes>
              <attributes>
                <name>cf.cplace.riskManagement.risk.level</name>
                <localizedName>
                  <en>Risk Level</en>
                  <de>Risikostufe</de>
                </localizedName>
                <localizedShortName />
                <shortHelp />
                <constraintFactory type="numberConstraint">
                  <precision>1</precision>
                  <localizedTextAfterSupplier />
                  <multiplicity>
                    <key>exactlyOne</key>
                  </multiplicity>
                  <attributeDefClass>cf.cplace.platform.assets.custom.def.SingleNumberAttributeDef</attributeDefClass>
                </constraintFactory>
              </attributes>
              <attributes>
                <name>cf.cplace.riskManagement.risk.mitigations</name>
                <localizedName>
                  <en>Mitigations</en>
                  <de>Minderungsmaßnahmen</de>
                </localizedName>
                <localizedShortName />
                <shortHelp />
                <constraintFactory type="referenceConstraint">
                  <typeNames>cf.cplace.riskManagement.mitigation</typeNames>
                  <entityClass>cf.cplace.platform.assets.file.Page</entityClass>
                  <localizedInverseRoleName />
                  <sameWorkspace>true</sameWorkspace>
                  <isHierarchy>false</isHierarchy>
                  <multiplicity />
                  <attributeDefClass>cf.cplace.platform.assets.custom.def.MultiReferenceAttributeDef$MultiCustomReferenceAttributeDef</attributeDefClass>
                </constraintFactory>
              </attributes>
              <appliesTo>
                <key>page</key>
              </appliesTo>
              <localizedPageNamesMode>
                <key>none</key>
              </localizedPageNamesMode>
              <showNewButton>true</showNewButton>
            </typeDef>
            <typeDef>
              <name>cf.cplace.riskManagement.mitigation</name>
              <localizedNameSingular>
                <en>Mitigation</en>
                <de>Minderungsmaßnahme</de>
              </localizedNameSingular>
              <localizedNamePlural>
                <en>Mitigations</en>
                <de>Minderungsmaßnahmen</de>
              </localizedNamePlural>
              <iconName>fa-shield-alt</iconName>
              <attributes>
                <name>cf.cplace.riskManagement.mitigation.description</name>
                <localizedName>
                  <en>Description</en>
                  <de>Beschreibung</de>
                </localizedName>
                <localizedShortName />
                <shortHelp />
                <constraintFactory type="richStringConstraint">
                  <multiplicity>
                    <key>exactlyOne</key>
                  </multiplicity>
                  <attributeDefClass>cf.cplace.platform.assets.custom.def.SingleRichStringAttributeDef</attributeDefClass>
                </constraintFactory>
              </attributes>
              <attributes>
                <name>cf.cplace.riskManagement.mitigation.cost</name>
                <localizedName>
                  <en>Cost</en>
                  <de>Kosten</de>
                </localizedName>
                <localizedShortName />
                <shortHelp />
                <constraintFactory type="numberConstraint">
                  <precision>2</precision>
                  <localizedTextAfterSupplier />
                  <multiplicity>
                    <key>exactlyOne</key>
                  </multiplicity>
                  <attributeDefClass>cf.cplace.platform.assets.custom.def.SingleNumberAttributeDef</attributeDefClass>
                </constraintFactory>
              </attributes>
              <appliesTo>
                <key>page</key>
              </appliesTo>
              <localizedPageNamesMode>
                <key>none</key>
              </localizedPageNamesMode>
              <showNewButton>true</showNewButton>
            </typeDef>
          </types>
          <apps>["cf.cplace.platform"]</apps>
          <rootPage>
            <page>
              <name>Root Page</name>
              <id>czpx9mj237dsnh8vg6h6yerzv</id>
              <custom>
                <type>default.page</type>
                <attributes />
              </custom>
              <widgetContainer>
                <widgetsLayout />
                <widgets />
              </widgetContainer>
            </page>
          </rootPage>
        </workspace>
      </slot>
    </slots>
    <cplaceRelease>24.1</cplaceRelease>
    <publishDate>2024-01-25T14:49:25.893+01:00</publishDate>
  </package>
  <maps />
</solutionManagement>